{
  "schema": {
    "name": "expgym.trace",
    "version": "2.0.0"
  },
  "trace_id": "1651a0db-d026-463d-ba3d-ae6fed32227c",
  "provenance": {
    "created_at": "2026-09-08T05:25:28.852274+00:00",
    "repository": {
      "commit": "703719150e8d44712ace50d6439686423dcd1328",
      "dirty": true,
      "changed_files": [
        ".agents/skills/expgym-runner/SKILL.md",
        ".agents/skills/expgym-runner/references/experiment-matrix.md",
        ".agents/skills/expgym-runner/references/runbook.md",
        "README.MD",
        "demo_experiment.py",
        "docs/poolact.md",
        "expgym/extras/parallel_cache.py",
        "expgym/llm_clients.py",
        "expgym/poolact.py",
        "expgym/react_loop.py",
        "expgym/task_evidence_audit.py",
        "expgym/task_restricted_search.py",
        "expgym/task_tuning.py",
        "expgym/trace_v2.py",
        "schemas/trace-v2.schema.json",
        "scripts/run_full.sh",
        "scripts/run_hpobench_docker.sh",
        "scripts/run_paper_sweep.py",
        "scripts/run_poolact.py",
        "tests/test_llm_clients.py",
        "tests/test_poolact.py",
        "tests/test_react_loop.py",
        "tests/test_run_paper_sweep.py",
        "tests/test_run_poolact.py",
        "tests/test_task_tuning_hpobench.py",
        "tests/test_trace_v2.py",
        "docs/portable-study.md",
        "expgym/errors.py",
        "expgym/evaluation_identity.py",
        "expgym/execution_contract.py",
        "expgym/extras/aggregation_diagnostics.py",
        "expgym/tool_protocol.py",
        "scripts/analyze_portable_study.py",
        "tests/test_aggregation_diagnostics.py",
        "tests/test_analyze_portable_study.py",
        "tests/test_api_dump_provenance.py",
        "tests/test_audit_tool_schema.py",
        "tests/test_docker_endpoint_rewrite.py",
        "tests/test_evaluation_identity.py",
        "tests/test_execution_contract.py",
        "tests/test_generation_options.py",
        "tests/test_generation_sampling.py",
        "tests/test_invalid_final_configuration.py",
        "tests/test_json_answer_lookup.py",
        "tests/test_native_llm_clients.py",
        "tests/test_native_react_loop.py",
        "tests/test_native_task_context.py",
        "tests/test_poolact_aggregate_validation.py",
        "tests/test_poolact_costs.py",
        "tests/test_poolact_visibility.py",
        "tests/test_search_snapshot_selection.py",
        "tests/test_task_schemas.py",
        "tests/test_tool_protocol.py",
        "tests/test_tuning_validation.py"
      ],
      "tracked_diff_sha256": "cf112fa6784b25074a31e6c050d07a962a96b92ffc6a499fd8fc668378abb25e",
      "source_tree_sha256": "d1606db7d6036c8975ce9d3e556daf7fa2ce4604879f2b3878435b0f96aebb78",
      "source_file_count": 76
    },
    "environment": {
      "python": "3.11.15",
      "platform": "Linux-5.15.0-1088-azure-x86_64-with-glibc2.35",
      "packages": {
        "openai": null,
        "numpy": "2.4.6",
        "pyyaml": "6.0.3",
        "huggingface-hub": "1.30.0",
        "pyarrow": "21.0.0"
      }
    },
    "runner": "scripts/run_paper_sweep.py"
  },
  "run": {
    "resume_key": "930f4462b62b6786f08b6acaa8b9cfc06c14f5b628cc106d11da9edb937f8e3a",
    "evaluation_identity": {
      "version": "expgym.evaluation-inputs.v1",
      "selected": {
        "scenario": "tuning",
        "tuning_task": "hpobench:nasbench201:cifar10-valid"
      },
      "files": {
        "task_configuration": {
          "path": "/lustrefs/users/chufan.shi/codex_space_tn/LLM_ExpGym/configs/hpobench_tasks.yaml",
          "present": true,
          "bytes": 5947,
          "sha256": "fdbf6640aeb5a699bf1e512e3c3cfdf1d24d44d98ab3a03b2986d24c992cc36f"
        },
        "budget_oracle": {
          "path": "/lustrefs/users/chufan.shi/codex_space_tn/LLM_ExpGym/data/hpo_tuning/oracle3.json",
          "present": true,
          "bytes": 28814,
          "sha256": "f6a38069eb6d376a045562e8a17e67e600150c7a7b0ee994e46837679fcdb69e"
        },
        "table": {
          "path": "/lustrefs/users/chufan.shi/codex_space_tn/LLM_ExpGym/data/hpo_tuning/hpobench_data/nasbench_201_compact/cifar10-valid.pkl",
          "present": true,
          "bytes": 453445,
          "sha256": "c7983f199b89e1e0dc52c7963f850f8162095b2bbf0c090fb9a4d543bea8616e"
        },
        "decoder_source": {
          "path": "/lustrefs/users/chufan.shi/codex_space_tn/LLM_ExpGym/expgym/compact_nasbench201.py",
          "present": true,
          "bytes": 4319,
          "sha256": "eb549e5c179050998e2f87387c8ddeb99f01fd8d703c74908fbd927242935eed"
        },
        "table_manifest": {
          "path": "/lustrefs/users/chufan.shi/codex_space_tn/LLM_ExpGym/data/hpo_tuning/hpobench_data/nasbench_201_compact/manifest.json",
          "present": true,
          "bytes": 604,
          "sha256": "0b705ba5e5c210cec2a93825310b67b4361f94547f6ca8b1f9d8985f1e28dcdf"
        }
      },
      "dependencies": {
        "numpy": {
          "version": "2.4.6",
          "modules": {
            "numpy": {
              "path": "/lustrefs/users/chufan.shi/codex_space_tn/LLM_ExpGym/.venv/lib/python3.11/site-packages/numpy/__init__.py",
              "present": true,
              "bytes": 26277,
              "sha256": "92a46f791e453926d3292af2582b89995a289475f0eaaea71a949823200b838a"
            },
            "numpy._core._multiarray_umath": {
              "path": "/lustrefs/users/chufan.shi/codex_space_tn/LLM_ExpGym/.venv/lib/python3.11/site-packages/numpy/_core/_multiarray_umath.cpython-311-x86_64-linux-gnu.so",
              "present": true,
              "bytes": 10407681,
              "sha256": "1535fbed1e9ac6b717e72ad9bd5c20b9f0536a21084fcadc40c00255a8f35d1d"
            }
          }
        },
        "ConfigSpace": {
          "version": "1.2.1",
          "modules": {
            "ConfigSpace": {
              "path": "/lustrefs/users/chufan.shi/codex_space_tn/LLM_ExpGym/.venv/lib/python3.11/site-packages/ConfigSpace/__init__.py",
              "present": true,
              "bytes": 4860,
              "sha256": "90e7d4dfafdba1459fb8e347c4d8013ff80dcc8f69c0dbd5cf5adf7728c050ec"
            },
            "ConfigSpace.configuration_space": {
              "path": "/lustrefs/users/chufan.shi/codex_space_tn/LLM_ExpGym/.venv/lib/python3.11/site-packages/ConfigSpace/configuration_space.py",
              "present": true,
              "bytes": 51923,
              "sha256": "7f62ab5a5aebf9c89497b4446be1c488834bf1adaa6434247be688f0885d6a48"
            }
          }
        },
        "PyYAML": {
          "version": "6.0.3",
          "modules": {
            "yaml": {
              "path": "/lustrefs/users/chufan.shi/codex_space_tn/LLM_ExpGym/.venv/lib/python3.11/site-packages/yaml/__init__.py",
              "present": true,
              "bytes": 12311,
              "sha256": "b19dfcc333d6a75dfd73073901164507252f271b41d3b5f7d85510033a0547a7"
            }
          }
        }
      },
      "semantics": {},
      "python": {
        "version": "3.11.15",
        "implementation": "CPython",
        "machine": "x86_64",
        "byteorder": "little"
      },
      "scope": "selected input bytes and critical dependency modules; not a full environment attestation",
      "sha256": "535a33514d190931feaf01e5226f3c32c9a4e09ad5886370018b910075f92f32"
    },
    "seed": 1206,
    "backend": {
      "name": "openai",
      "base_url": "http://azure-uk-hpc-H200-instance-267:30241/v1/chat/completions",
      "auth_configured": true,
      "extra_header_names": []
    },
    "model": {
      "id": "kimi-k3"
    },
    "generation": {
      "temperature": 1.0,
      "top_p": 1.0,
      "seed": 1206,
      "chat_template_kwargs": {
        "thinking": true,
        "thinking_effort": "max"
      },
      "top_k": null,
      "provider": null,
      "reasoning": null,
      "max_tokens": 32768,
      "nothink_prefix": false,
      "reasoning_effort": "max"
    },
    "protocol": {
      "tool_protocol": "native",
      "max_protocol_retries": 1,
      "tuning_final_policy": "legacy"
    },
    "prompt_cache": {
      "key": null,
      "scope": "disabled"
    },
    "transport": {
      "timeout_seconds": 1800.0,
      "max_retries": 2,
      "retry_base_seconds": 3.0,
      "retry_max_seconds": 30.0,
      "retry_http_statuses": [
        429,
        500,
        502,
        503,
        504
      ]
    },
    "api_dump": {
      "schema_version": "expgym.api_attempt.v1",
      "client_id": "a4b08583e65d4f03a1d43b0e88408c60",
      "run_id": "pilot-a21:k3_a21_1203474_v3"
    }
  },
  "task": {
    "scenario": "tuning",
    "rep": 0,
    "item": {
      "kind": "tuning_task",
      "id": "hpobench:nasbench201:cifar10-valid"
    },
    "dataset": {
      "name": "hpobench",
      "revision": "repository-source"
    },
    "budget": {
      "regime": "cost_moderate",
      "mode": "time_aware",
      "base_cost_seconds": 11310.049790075853,
      "limit_seconds": 113100.49790075852
    },
    "limits": {
      "max_steps": 30,
      "max_evaluations": 30,
      "max_prompt_tokens": null,
      "max_context_tokens": null
    }
  },
  "messages": [
    {
      "role": "system",
      "content": "Interaction protocol: use the API's supplied function tools to acquire feedback. A textual Action directive or an imitation of a tool result is not a tool call. Make at most one function call per assistant turn. After receiving the real tool result, decide whether another observation is useful. When ready, submit your final answer in the task's required format (Answer: followed by the answer is also accepted). Do not invent observations or claim an unexecuted call succeeded.",
      "id": "m0001"
    },
    {
      "role": "user",